{"$schema":"https://json-schema.org/draft/2020-12/schema","type":"object","properties":{"$schema":{"type":"string"},"id":{"type":"string","minLength":1,"maxLength":50,"pattern":"^[a-z0-9](?:[a-z0-9.-]*[a-z0-9])?$"},"url":{"type":"string","format":"uri"},"manifestUrl":{"type":"string","format":"uri"},"features":{"type":"array","items":{"type":"string","enum":["open-source","mobile","desktop","auth","offline","data-collection"]}},"githubUrl":{"type":"string","format":"starts_with","pattern":"^https:\\/\\/github\\.com\\/.*"},"gitlabUrl":{"type":"string","format":"starts_with","pattern":"^https:\\/\\/gitlab\\.com\\/.*"},"syncGitHubReleases":{"type":"boolean"},"privacyPolicyUrl":{"type":"string","format":"uri"},"termsAndConditionsUrl":{"type":"string","format":"uri"},"categories":{"type":"array","items":{"type":"string","enum":["news","social","chat","messenger","messaging","entertainment","video","movies","tv","streaming","utilities","tool","tools","utility","productivity","work","business","office","education","games","game","gaming","music","audio","sound","development","code","coding","program","programming","developer","developers","lifestyle","photo","travel","trip","health","books"]}},"author":{"type":"string","minLength":1,"maxLength":30},"authorUrl":{"type":"string","format":"uri"},"accentColor":{"type":"string"},"updatedDate":{"type":"string","format":"date","pattern":"^(?:(?:\\d\\d[2468][048]|\\d\\d[13579][26]|\\d\\d0[48]|[02468][048]00|[13579][26]00)-02-29|\\d{4}-(?:(?:0[13578]|1[02])-(?:0[1-9]|[12]\\d|3[01])|(?:0[469]|11)-(?:0[1-9]|[12]\\d|30)|(?:02)-(?:0[1-9]|1\\d|2[0-8])))$"}},"required":["$schema","id","url","features","author","updatedDate"],"additionalProperties":false}