{
	"$schema": "../app-spec-schema.json",
	"id": "dev.vscode.insiders",
	"url": "https://insiders.vscode.dev",
	"manifestUrl": "https://insiders.vscode.dev/static/insider/code.webmanifest",
	"features": [
		"desktop",
		"offline",
		"open-source"
	],
	"githubUrl": "https://github.com/microsoft/vscode",
	"categories": [
		"development"
	],
	"termsAndConditionsUrl": "https://www.microsoft.com/en-us/legal/terms-of-use",
	"privacyPolicyUrl": "https://www.microsoft.com/en-gb/privacy/privacystatement",
	"author": "Microsoft",
	"authorUrl": "https://microsoft.com/",
	"accentColor": "#0eb49c",
	"updatedDate": "2025-04-16"
}
