{
	"$schema": "../app-spec-schema.json",
	"id": "com.journalisticapp.pwa",
	"url": "https://pwa.journalisticapp.com",
	"manifestUrl": "https://pwa.journalisticapp.com/manifest.json",
	"features": [
		"desktop",
		"mobile",
		"auth",
		"data-collection"
	],
	"categories": [
		"lifestyle"
	],
	"termsAndConditionsUrl": "https://journalisticapp.com/terms",
	"privacyPolicyUrl": "https://journalisticapp.com/privacy",
	"author": "Journalistic",
	"accentColor": "#7f7f7f",
	"updatedDate": "2025-04-16"
}
