{
	"$schema": "../app-spec-schema.json",
	"id": "com.appspot.guitar-tuner",
	"url": "https://guitar-tuner.appspot.com/",
	"manifestUrl": "https://guitar-tuner.appspot.com/manifest.json",
	"features": [
		"mobile",
		"desktop",
		"offline",
		"open-source"
	],
	"githubUrl": "https://github.com/googlearchive/guitar-tuner",
	"categories": [
		"utilities"
	],
	"author": "Paul Lewis",
	"accentColor": "#efb90f",
	"updatedDate": "2025-04-16"
}
