{
	"$schema": "../app-spec-schema.json",
	"id": "com.spotify.open",
	"url": "https://open.spotify.com",
	"manifestUrl": "https://open.spotifycdn.com/cdn/generated/manifest-mobile-web-player.a1ddf51c.json",
	"features": [
		"mobile",
		"desktop",
		"auth"
	],
	"categories": [
		"music"
	],
	"termsAndConditionsUrl": "https://spotify.com/us/legal/end-user-agreement/",
	"privacyPolicyUrl": "https://spotify.com/us/legal/privacy-policy/",
	"author": "Spotify",
	"authorUrl": "https://spotify.com",
	"accentColor": "#1cd363",
	"updatedDate": "2025-04-16"
}
