{
	"$schema": "../app-spec-schema.json",
	"id": "dev.vscode",
	"url": "https://vscode.dev",
	"manifestUrl": "https://vscode.dev/static/stable/code.webmanifest",
	"features": [
		"desktop",
		"offline",
		"open-source"
	],
	"githubUrl": "https://github.com/microsoft/vscode",
	"categories": [
		"development"
	],
	"termsAndConditionsUrl": "https://www.microsoft.com/en-us/legal/terms-of-use",
	"privacyPolicyUrl": "https://www.microsoft.com/en-gb/privacy/privacystatement",
	"author": "Microsoft",
	"authorUrl": "https://microsoft.com/",
	"accentColor": "#24adf4",
	"updatedDate": "2025-04-16"
}
