{
	"$schema": "../app-spec-schema.json",
	"id": "com.google.santatracker",
	"url": "https://santatracker.google.com",
	"manifestUrl": "https://santatracker.google.com/manifest.json",
	"features": [
		"desktop",
		"mobile",
		"data-collection"
	],
	"termsAndConditionsUrl": "https://policies.google.com/terms",
	"privacyPolicyUrl": "https://policies.google.com/privacy",
	"categories": [
		"games"
	],
	"author": "Google",
	"accentColor": "#e13d34",
	"updatedDate": "2025-04-16"
}
