{
	"$schema": "../app-spec-schema.json",
	"id": "io.github.matthijsgroen.block-sort",
	"url": "https://matthijsgroen.github.io/block-sort/",
	"author": "Matthijs Groen",
	"manifestUrl": "https://matthijsgroen.github.io/block-sort/manifest.webmanifest",
	"features": [
		"open-source",
		"mobile",
		"desktop",
		"offline"
	],
	"categories": ["games"],
	"githubUrl": "https://github.com/matthijsgroen/block-sort",
	"updatedDate": "2025-04-16"
}
