{
	"$schema": "../app-spec-schema.json",
	"id": "com.google.maps",
	"url": "https://google.com/maps",
	"manifestUrl": "https://google.com/maps/preview/pwa/manifest",
	"features": [
		"mobile",
		"desktop",
		"data-collection"
	],
	"termsAndConditionsUrl": "https://policies.google.com/terms",
	"privacyPolicyUrl": "https://policies.google.com/privacy",
	"categories": [
		"lifestyle"
	],
	"author": "Google",
	"accentColor": "#fbbb05",
	"updatedDate": "2025-04-16"
}
