{
	"$schema": "../app-spec-schema.json",
	"id": "app.screenrecorderweb",
	"url": "https://screenrecorderweb.app",
	"manifestUrl": "https://screenrecorderweb.app/manifest.json",
	"features": [
		"desktop",
		"offline",
		"open-source"
	],
	"githubUrl": "https://github.com/carsonsaldanha/screen-recorder",
	"categories": [
		"utilities"
	],
	"author": "Carson Saldanha",
	"accentColor": "#c4241c",
	"updatedDate": "2025-04-16"
}
