{
	"$schema": "../app-spec-schema.json",
	"id": "com.monkeytype",
	"url": "https://monkeytype.com",
	"manifestUrl": "https://monkeytype.com/manifest.json",
	"features": [
		"open-source",
		"desktop",
		"mobile",
		"offline"
	],
	"githubUrl": "https://github.com/monkeytypegame/monkeytype",
	"categories": [
		"utilities",
		"games"
	],
	"termsAndConditionsUrl": "https://monkeytype.com/terms-of-service",
	"privacyPolicyUrl": "https://monkeytype.com/privacy-policy",
	"author": "Miodec",
	"accentColor": "#dcb015",
	"updatedDate": "2025-04-16"
}
