{
	"$schema": "../app-spec-schema.json",
	"id": "io.github.nenadalm.life-counter",
	"url": "https://nenadalm.github.io/life-counter/",
	"author": "Miloslav Nenad√°l",
	"manifestUrl": "https://nenadalm.github.io/life-counter/manifest.json",
	"features": [
		"open-source",
		"mobile",
		"offline"
	],
	"categories": ["games"],
	"githubUrl": "https://github.com/nenadalm/life-counter",
	"updatedDate": "2025-04-16"
}
