{
	"$schema": "../app-spec-schema.json",
	"id": "site.esstudio.newsfeeder",
	"url": "https://newsfeeder.esstudio.site",
	"manifestUrl": "https://newsfeeder.esstudio.site/manifest.json",
	"features": [
		"mobile",
		"desktop"
	],
	"categories": [
		"news"
	],
	"author": "Sem Postma",
	"accentColor": "#f45c3d",
	"updatedDate": "2025-04-08"
}
