{
	"$schema": "../app-spec-schema.json",
	"id": "dev.daily.app",
	"url": "https://app.daily.dev",
	"manifestUrl": "https://app.daily.dev/manifest.json",
	"features": [
		"mobile",
		"desktop",
		"open-source"
	],
	"githubUrl": "https://github.com/dailydotdev/daily",
	"categories": [
		"news",
		"development"
	],
	"termsAndConditionsUrl": "https://daily.dev/tos",
	"privacyPolicyUrl": "https://daily.dev/privacy/applications-policy",
	"author": "daily.dev",
	"accentColor": "#448cfc",
	"updatedDate": "2025-04-16"
}
