{
	"$schema": "../app-spec-schema.json",
	"id": "com.tiktok",
	"url": "https://tiktok.com",
	"manifestUrl": "https://tiktok.com/manifest.json",
	"features": [
		"mobile",
		"desktop"
	],
	"categories": [
		"social",
		"entertainment"
	],
	"privacyPolicyUrl": "https://www.tiktok.com/legal/page/us/privacy-policy/en",
	"termsAndConditionsUrl": "https://www.tiktok.com/legal/page/us/terms-of-service/en",
	"author": "ByteDance",
	"accentColor": "#24f3eb",
	"updatedDate": "2025-04-16"
}
