{
	"$schema": "../app-spec-schema.json",
	"id": "com.boxy-svg.app",
	"url": "https://boxy-svg.com/app",
	"manifestUrl": "https://boxy-svg.com/boxy-svg.webmanifest",
	"features": [
		"desktop",
		"offline"
	],
	"categories": [
		"lifestyle"
	],
	"privacyPolicyUrl": "https://boxy-svg.com/legal/web-privacy",
	"termsAndConditionsUrl": "https://boxy-svg.com/legal/web-terms",
	"author": "Jaros≈Çaw Foksa",
	"accentColor": "#fbbb4c",
	"updatedDate": "2025-04-16"
}
