{
	"$schema": "../app-spec-schema.json",
	"id": "eu.mconverter",
	"url": "https://mconverter.eu",
	"manifestUrl": "https://mconverter.eu/manifest.json",
	"features": [
		"mobile",
		"desktop"
	],
	"categories": [
		"utilities",
		"lifestyle",
		"entertainment"
	],
	"author": "MConverter",
	"accentColor": "#5494fc",
	"updatedDate": "2025-04-15"
}
