{
	"$schema": "../app-spec-schema.json",
	"id": "app.web.othello-rust",
	"url": "https://othello-rust.web.app/",
	"manifestUrl": "https://othello-rust.web.app/manifest.webmanifest",
	"features": [
		"open-source",
		"mobile",
		"desktop",
		"offline"
	],
	"categories": ["games"],
	"githubUrl": "https://github.com/nstringham/othello-web-app",
	"author": "Nate Stringham",
	"updatedDate": "2025-04-16"
}
