{
	"$schema": "../app-spec-schema.json",
	"id": "rocks.m4.paquet",
	"author": "m4rocks",
	"githubUrl": "https://github.com/m4rocks/paquet",
	"features": ["desktop", "mobile", "open-source"],
	"termsAndConditionsUrl": "https://paquet.m4.rocks/terms-and-conditions",
	"privacyPolicyUrl": "https://paquet.m4.rocks/privacy",
	"authorUrl": "https://m4.rocks",
	"url": "https://paquet.m4.rocks",
	"updatedDate": "2025-04-14"
}