{
	"$schema": "../app-spec-schema.json",
	"id": "com.youtube.music",
	"url": "https://music.youtube.com/",
	"manifestUrl": "https://music.youtube.com/manifest.webmanifest",
	"features": [
		"mobile",
		"desktop"
	],
	"categories": [
		"entertainment",
		"music"
	],
	"author": "YouTube",
	"accentColor": "#fc0404",
	"updatedDate": "2025-04-08"
}
