{
	"$schema": "../app-spec-schema.json",
	"id": "app.web.wallpeppers",
	"url": "https://wallpeppers.web.app",
	"manifestUrl": "https://wallpeppers.web.app/manifest.json",
	"features": [
		"mobile",
		"desktop",
		"open-source"
	],
	"categories": [
		"lifestyle",
		"utilities"
	],
	"author": "undefyned",
	"accentColor": "#fc9504",
	"updatedDate": "2025-04-16"
}
